Text,True Label,Model Score
Supporting clean energy development can enhance economic growth and environmental sustainability.,3,-0.9543
Fiscal responsibility involves balancing government spending with economic growth.,1,0.227
Moderate healthcare reforms should improve access while controlling costs.,3,-0.127
Encouraging energy independence can enhance both economic security and sustainability.,3,0.463
Promoting vocational training can address skill gaps and boost employment opportunities.,1,0.3536
Moderate regulation can ensure market stability while fostering innovation.,1,0.8276
Supporting renewable energy initiatives can drive sustainable economic growth.,3,-0.9857
Balanced trade policies should protect domestic industries while promoting global competitiveness.,1,0.594
Public investment in education is crucial for long-term economic prosperity and social equity.,3,-0.9757
Encouraging public-private partnerships can enhance infrastructure and services.,1,-0.08
Moderate environmental policies can protect resources while supporting economic growth.,3,-0.1992
Supporting small businesses is key to economic resilience and job creation.,1,0.8209
Investing in public health can lead to a healthier more productive society.,3,-0.9308
Moderate tax incentives can stimulate investment without reducing government revenue.,1,0.7508
Expanding affordable healthcare is essential for social and economic well-being.,3,-0.9888
Promoting energy efficiency can reduce costs and enhance economic resilience.,1,-0.2437
Moderate social programs should provide a safety net without creating dependency.,1,-0.6265
Supporting clean energy research can boost economic growth and environmental sustainability.,3,-0.9743
Balanced fiscal policies should promote economic stability and sustainable growth.,1,0.9444
Encouraging public health initiatives can improve overall quality of life.,3,-0.2832
Moderate increases in minimum wage can boost income without harming employment.,3,-0.5149
Supporting infrastructure development is key to economic growth and efficiency.,1,-0.7016
Promoting affordable housing initiatives can reduce economic disparities.,3,-0.9896
Balanced economic policies should enhance growth while ensuring fairness.,1,0.1633
Moderate healthcare reforms should balance cost control with quality improvement.,3,0.1899
Encouraging balanced urban development can enhance economic and social outcomes.,3,-0.5864
Supporting moderate increases in public spending can stimulate growth.,1,0.4546
Promoting green energy technologies can enhance economic growth and environmental protection.,3,-0.9801
Moderate labor policies should protect workers while encouraging job creation.,1,0.6397
Expanding social programs can provide support for vulnerable populations.,3,-0.9634
Supporting technological innovation can drive economic growth and improve quality of life.,1,0.7464
Investing in renewable energy is crucial for long-term sustainability and economic growth.,3,-0.9968
Moderate fiscal policies should balance economic growth with responsible spending.,1,0.0599
Promoting public health campaigns can improve community health and wellness.,3,-0.8958
Encouraging moderate economic reforms can enhance competitiveness and inclusivity.,1,-0.8126
Supporting renewable energy adoption can reduce carbon emissions and boost economic growth.,3,-0.9901
Balanced economic strategies should focus on growth and social equity.,1,0.1161
Moderate environmental regulations can protect ecosystems while supporting economic activity.,3,-0.4844
Encouraging sustainable practices through moderate regulation can benefit the economy.,1,-0.5015
Promoting public investment in green technology can drive innovation and sustainability.,3,-0.9747
Balanced fiscal discipline is crucial for long-term economic health.,1,0.9655
Supporting clean energy initiatives can drive sustainable economic progress.,3,-0.9929
Moderate increases in public investment can enhance infrastructure and quality of life.,1,-0.1973
Encouraging moderate healthcare reforms can improve access and control costs.,3,-0.4468
Supporting moderate innovation policies can drive technological advancement and economic growth.,1,0.7591
Promoting affordable healthcare is key to reducing medical costs and improving access.,3,-0.9379
Balanced economic policies should aim to enhance both growth and social equity.,1,0.3545
Supporting balanced environmental policies can protect natural resources and promote economic activity.,3,-0.0128
Moderate public safety reforms should balance enforcement with community relations.,1,0.0722
Encouraging balanced trade policies can boost economic growth while protecting domestic interests.,1,0.9188
Moderate tax reforms can enhance economic efficiency while maintaining essential services.,1,0.4076
Supporting renewable energy development can create jobs and promote sustainability.,3,-0.9781
Fiscal responsibility involves prudent spending and investment in growth areas.,1,0.6562
Moderate healthcare reforms should ensure affordability and improve quality.,3,-0.7678
Encouraging balanced energy policies can enhance both economic and environmental outcomes.,3,-0.4391
Promoting technical education can boost employment and meet industry needs.,1,-0.349
Moderate regulation can balance economic growth with consumer protection.,1,0.6776
Supporting green technology can drive sustainable economic development.,3,-0.9754
Balanced trade policies should support domestic growth and global integration.,1,0.7014
Public investment in healthcare can improve social outcomes and economic productivity.,3,-0.8856
Encouraging moderate tax cuts can boost disposable income and stimulate spending.,1,0.7248
Moderate environmental initiatives can protect resources and foster economic growth.,3,-0.3224
Supporting entrepreneurship is crucial for economic vitality and innovation.,1,0.9656
Investing in public transportation can reduce congestion and promote sustainability.,3,-0.9808
Moderate tax incentives can encourage business investment and economic growth.,1,0.8604
Expanding access to healthcare can enhance public health and economic stability.,3,-0.3398
Promoting energy efficiency can save costs and enhance economic competitiveness.,1,0.2958
Moderate social safety nets should support those in need while encouraging self-reliance.,1,0.9734
Supporting clean energy research can boost both economic and environmental benefits.,3,-0.9576
Balanced fiscal strategies should promote stability and long-term growth.,1,0.7644
Encouraging public health measures can improve community well-being and productivity.,3,-0.5395
Moderate wage policies can raise incomes without negatively impacting employment.,3,-0.2935
Supporting infrastructure projects is key to economic growth and resilience.,1,-0.8378
Promoting affordable housing can reduce inequality and support economic growth.,3,-0.9944
Balanced economic policies should foster growth while ensuring equitable opportunities.,1,0.0441
Moderate healthcare reforms should balance cost efficiency with access improvement.,3,0.2489
Encouraging balanced development policies can enhance economic and social outcomes.,3,-0.4765
Supporting moderate public investment can drive growth and improve living standards.,1,-0.0104
Promoting renewable energy initiatives can reduce emissions and enhance economic growth.,3,-0.9826
Moderate labor policies should ensure fair wages and job creation.,1,-0.7018
Expanding social welfare can provide security for vulnerable populations.,3,-0.9771
Supporting technological progress can enhance economic growth and quality of life.,1,0.3447
Investing in green infrastructure is essential for sustainable economic growth.,3,-0.9972
Moderate fiscal policies should balance growth with prudent financial management.,1,0.1958
Promoting wellness programs can improve public health and economic productivity.,3,-0.6834
Encouraging moderate economic reforms can enhance efficiency and inclusivity.,1,-0.8137
Supporting clean energy adoption can drive innovation and environmental benefits.,3,-0.906
Balanced economic strategies should enhance competitiveness and social welfare.,1,0.7868
Moderate environmental protections can safeguard ecosystems while supporting growth.,3,-0.9205
Encouraging sustainable business practices can benefit both the economy and the environment.,1,-0.6706
Promoting investment in renewable resources can drive long-term economic sustainability.,3,-0.9895
Balanced fiscal discipline is crucial for economic resilience and growth.,1,0.9293
Supporting green energy projects can create jobs and protect the environment.,3,-0.9879
Moderate increases in infrastructure spending can boost economic growth.,1,0.1098
Encouraging healthcare reforms can improve access and control costs.,3,-0.4961
Supporting balanced innovation policies can drive economic and technological progress.,1,0.5701
Promoting healthcare access is essential for reducing costs and improving outcomes.,3,-0.9073
Balanced economic policies should promote growth and social inclusivity.,1,-0.094
Supporting moderate environmental policies can protect natural resources and enhance growth.,3,0.3355
Moderate public safety initiatives should balance enforcement with community engagement.,1,0.0318
Encouraging balanced trade and economic policies can enhance growth and stability.,1,0.5759
